page,query,clicks,impressions,ctr,position
https://www.mothebroker.com/,orange county mortgage brokers,1,3,0.3333333333333333,40.666666666666664
https://www.mothebroker.com/blog/home-equity-ventura-county-guide-2026,bioatla,1,3,0.3333333333333333,6.333333333333333
https://www.mothebroker.com/blog/reverse-mortgage-interest-rates-current-2026,current hecm reverse mortgage rates march 2026,1,88,0.011363636363636364,1.2840909090909092
https://www.mothebroker.com/tools/property-tax-estimator/ca/los-angeles-county/west-covina,west covina property tax rate,1,5,0.2,5.4
https://www.mothebroker.com/tools/property-tax-estimator/ca/orange-county/anaheim,how much are my property taxes for 2026,1,3,0.3333333333333333,4
https://www.mothebroker.com/tools/property-tax-estimator/ca/orange-county/fullerton,how much are my property taxes for 2026,1,1,1,25
https://www.mothebroker.com/tools/property-tax-estimator/ca/san-diego-county/carlsbad,carlsbad ca property tax rate,1,7,0.14285714285714285,8
https://mothebroker.com/areas/seal-beach-mortgage-broker,mothebroker.com,0,19,0,4.684210526315789
https://mothebroker.com/guides/orange-county-investment-property,mothebroker.com,0,13,0,3.6153846153846154
https://mothebroker.com/guides/orange-county-school-districts,mothebroker.com,0,1,0,5
https://mothebroker.com/guides/spring-2025-home-buying-guide,mothebroker.com,0,8,0,14.625
https://mothebroker.com/zip-codes/92614-irvine-mortgage-broker,mortgage broker 92614,0,4,0,21.75
https://mothebroker.com/zip-codes/92614-irvine-mortgage-broker,mothebroker.com,0,13,0,9.307692307692308
https://www.mothebroker.com/,best mortgage broker los angeles,0,1,0,81
https://www.mothebroker.com/,best mortgage broker near me,0,9,0,77.88888888888889
https://www.mothebroker.com/,cash loans near me,0,1,0,29
https://www.mothebroker.com/,demo loan broker,0,1,0,72
https://www.mothebroker.com/,find a mortgage broker,0,7,0,73.57142857142857
https://www.mothebroker.com/,hmo mortgage broker,0,4,0,79.25
https://www.mothebroker.com/,home mortgage broker,0,1,0,44
https://www.mothebroker.com/,jumbo loans,0,3,0,1
https://www.mothebroker.com/,jumbo mortgage loans,0,8,0,1
https://www.mothebroker.com/,lending broker,0,1,0,88
https://www.mothebroker.com/,local mortgage broker,0,2,0,40
https://www.mothebroker.com/,local mortgage brokers near me,0,8,0,55.625
https://www.mothebroker.com/,los angeles mortgage broker,0,8,0,61.75
https://www.mothebroker.com/,los angeles mortgage brokers,0,1,0,65
https://www.mothebroker.com/,lumin mortgage,0,1,0,100
https://www.mothebroker.com/,moreno valley mortgage broker,0,2,0,38.5
https://www.mothebroker.com/,mortgage agent richmond hill,0,5,0,63.8
https://www.mothebroker.com/,mortgage broker alamo,0,3,0,77.33333333333333
https://www.mothebroker.com/,mortgage broker burbank,0,1,0,81
https://www.mothebroker.com/,mortgage broker elk grove ca,0,1,0,79
https://www.mothebroker.com/,mortgage broker in los angeles,0,5,0,86
https://www.mothebroker.com/,mortgage broker los angeles,0,3,0,74.33333333333333
https://www.mothebroker.com/,mortgage broker orange,0,1,0,84
https://www.mothebroker.com/,mortgage broker orange county,0,3,0,86.33333333333333
https://www.mothebroker.com/,mortgage broker tulare,0,1,0,79
https://www.mothebroker.com/,mortgage brokers in los angeles,0,1,0,83
https://www.mothebroker.com/,mortgage brokers in los angeles ca,0,1,0,72
https://www.mothebroker.com/,mortgage brokers in los angeles california,0,1,0,69
https://www.mothebroker.com/,mortgage brokers in orange county,0,1,0,79
https://www.mothebroker.com/,mortgage brokers lenders elk grove,0,2,0,47.5
https://www.mothebroker.com/,mortgage brokers lenders orange,0,2,0,63
https://www.mothebroker.com/,mortgage brokers los angeles,0,3,0,81
https://www.mothebroker.com/,mortgage brokers los angeles ca,0,1,0,90
https://www.mothebroker.com/,mortgage brokers orange county,0,1,0,67
https://www.mothebroker.com/,mortgage ca,0,1,0,10
https://www.mothebroker.com/,mortgage companies in orange county,0,1,0,93
https://www.mothebroker.com/,mortgage company orange county,0,1,0,74
https://www.mothebroker.com/,mortgage lenders in orange county,0,1,0,78
https://www.mothebroker.com/,mortgage lenders orange county,0,1,0,84
https://www.mothebroker.com/,mortgage rates,0,1,0,3
https://www.mothebroker.com/,mothebroker.com,0,61,0,1
https://www.mothebroker.com/,orange county mortgage broker,0,1,0,43
https://www.mothebroker.com/,orange county mortgage lenders,0,2,0,64
https://www.mothebroker.com/,refinance,0,1,0,12
https://www.mothebroker.com/,refinancing,0,3,0,15.666666666666666
https://www.mothebroker.com/,santa ana mortgage broker,0,2,0,71.5
https://www.mothebroker.com/,santa clara mortgage broker,0,1,0,57
https://www.mothebroker.com/,tulare mortgage broker,0,2,0,76
https://www.mothebroker.com/,va loans mesa,0,1,0,1
https://www.mothebroker.com/,wholesale lenders,0,2,0,8.5
https://www.mothebroker.com/,wmb mortgage,0,1,0,51
https://www.mothebroker.com/areas,irvine ca mortgage rates,0,1,0,74
https://www.mothebroker.com/areas,irvine california mortgage rates,0,2,0,73.5
https://www.mothebroker.com/areas,irvine mortgage rates,0,10,0,62.9
https://www.mothebroker.com/areas,redondo mortgage center,0,2,0,66
https://www.mothebroker.com/areas,santa ana california mortgage rates,0,1,0,66
https://www.mothebroker.com/areas/irvine-mortgage-broker,92612 mortgage,0,3,0,14
https://www.mothebroker.com/areas/irvine-mortgage-broker,92612 mortgage lender,0,5,0,15.6
https://www.mothebroker.com/areas/irvine-mortgage-broker,asset depletion loans in aliso viejo,0,2,0,84.5
https://www.mothebroker.com/areas/irvine-mortgage-broker,home lenders near me,0,1,0,20
https://www.mothebroker.com/areas/irvine-mortgage-broker,home loan broker near me,0,1,0,19
https://www.mothebroker.com/areas/irvine-mortgage-broker,irvine ca mortgage rates,0,1,0,53
https://www.mothebroker.com/areas/irvine-mortgage-broker,irvine california mortgage rates,0,3,0,55.666666666666664
https://www.mothebroker.com/areas/irvine-mortgage-broker,irvine mortgage,0,4,0,70.5
https://www.mothebroker.com/areas/irvine-mortgage-broker,irvine mortgage broker,0,17,0,41.411764705882355
https://www.mothebroker.com/areas/irvine-mortgage-broker,irvine mortgage lender,0,10,0,49.4
https://www.mothebroker.com/areas/irvine-mortgage-broker,irvine mortgage lenders,0,2,0,65.5
https://www.mothebroker.com/areas/irvine-mortgage-broker,irvine mortgage rates,0,20,0,49.85
https://www.mothebroker.com/areas/irvine-mortgage-broker,mortgage advisor irvine,0,1,0,88
https://www.mothebroker.com/areas/irvine-mortgage-broker,mortgage brokers in irvine ca,0,1,0,93
https://www.mothebroker.com/areas/irvine-mortgage-broker,mortgage companies in irvine ca,0,1,0,70
https://www.mothebroker.com/areas/irvine-mortgage-broker,mortgage lenders near me,0,28,0,46.17857142857143
https://www.mothebroker.com/areas/irvine-mortgage-broker,mortgage loans near me,0,1,0,17
https://www.mothebroker.com/areas/irvine-mortgage-broker,mortgage near me,0,58,0,55.56896551724138
https://www.mothebroker.com/areas/irvine-mortgage-broker,mortgage rates irvine,0,1,0,73
https://www.mothebroker.com/areas/irvine-mortgage-broker,mothebroker.com,0,11,0,8
https://www.mothebroker.com/areas/irvine-neighborhoods,irvine california mortgage rates,0,1,0,77
https://www.mothebroker.com/areas/irvine-neighborhoods,irvine mello roos,0,1,0,88
https://www.mothebroker.com/areas/irvine-neighborhoods,irvine mortgage rates,0,4,0,73.75
https://www.mothebroker.com/areas/irvine-neighborhoods/northwood-mortgage-broker,mothebroker.com,0,4,0,17.25
https://www.mothebroker.com/areas/irvine-neighborhoods/turtle-rock-mortgage-broker,mothebroker.com,0,3,0,18.333333333333332
https://www.mothebroker.com/areas/washington,lumin lending,0,1,0,56
https://www.mothebroker.com/articles/dana-point-first-time-homebuyer-guide,mothebroker.com,0,5,0,8.4
https://www.mothebroker.com/articles/dana-point-first-time-homebuyer-guide,nmls 1566096,0,2,0,8
https://www.mothebroker.com/articles/newport-beach-mortgage-guide-2026,mothebroker.com,0,5,0,5.6
https://www.mothebroker.com/articles/orange-county-mortgage-rate-trends-august-2026,mothebroker.com,0,13,0,12.692307692307692
https://www.mothebroker.com/articles/wholesale-vs-retail-mortgages-comparison,mothebroker.com,0,13,0,10.846153846153847
https://www.mothebroker.com/blog/200-lender-advantage-explained-2026,mothebroker.com,0,5,0,9.8
https://www.mothebroker.com/blog/adu-financing-home-equity-california-2026,adu financing options california 2026,0,1,0,16
https://www.mothebroker.com/blog/aliso-viejo-mortgage-guide-2026,aliso viejo mortgage rates,0,3,0,76
https://www.mothebroker.com/blog/aliso-viejo-mortgage-guide-2026,mothebroker.com,0,4,0,11.25
https://www.mothebroker.com/blog/arm-to-fixed-refinance-strategy-2026,best strategies for refinancing adjustable-rate mortgage arm to fixed-rate 2025 2026,0,1,0,10
https://www.mothebroker.com/blog/arm-to-fixed-refinance-strategy-2026,best strategies for refinancing arm to fixed-rate mortgage 2025 2026,0,2,0,9
https://www.mothebroker.com/blog/arm-to-fixed-refinance-strategy-2026,can i refinance an arm mortgage,0,1,0,76
https://www.mothebroker.com/blog/arm-to-fixed-refinance-strategy-2026,can you refinance an arm loan to fixed rate,0,1,0,71
https://www.mothebroker.com/blog/arm-to-fixed-refinance-strategy-2026,can you refinance an arm mortgage,0,1,0,63
https://www.mothebroker.com/blog/arm-to-fixed-refinance-strategy-2026,can you refinance an arm to another arm,0,2,0,76
https://www.mothebroker.com/blog/arm-to-fixed-refinance-strategy-2026,how to refinance mortgage into arm to lower monthly payments 2026,0,1,0,9
https://www.mothebroker.com/blog/arm-to-fixed-refinance-strategy-2026,mortgage rate lock refinance process 2026,0,1,0,5
https://www.mothebroker.com/blog/arm-to-fixed-refinance-strategy-2026,refinance arm to fixed,0,2,0,65
https://www.mothebroker.com/blog/arm-to-fixed-refinance-strategy-2026,refinancing arm to fixed rate mortgage 2026,0,1,0,4
https://www.mothebroker.com/blog/arm-to-fixed-refinance-strategy-2026,refinancing arm to fixed rate mortgage before adjustment 2026,0,4,0,5
https://www.mothebroker.com/blog/arm-to-fixed-refinance-strategy-2026,should i refinance arm to fixed rate before adjustment 2026,0,2,0,7.5
https://www.mothebroker.com/blog/arm-to-fixed-refinance-strategy-2026,should i refinance my fixed rate mortgage to an arm,0,1,0,79
https://www.mothebroker.com/blog/asset-depletion-loans-guide-2026,asset depletion mortgage 2026,0,4,0,8.75
https://www.mothebroker.com/blog/asset-depletion-loans-guide-2026,asset depletion mortgage guidelines fannie mae freddie mac 2026,0,6,0,9.333333333333334
https://www.mothebroker.com/blog/asset-depletion-loans-guide-2026,asset depletion mortgage qualification 2026,0,12,0,4.5
https://www.mothebroker.com/blog/asset-depletion-loans-guide-2026,asset depletion mortgage qualification guidelines 2026,0,4,0,6
https://www.mothebroker.com/blog/asset-depletion-loans-guide-2026,asset depletion mortgage qualification requirements 2026,0,3,0,6
https://www.mothebroker.com/blog/asset-depletion-loans-guide-2026,asset depletion mortgage rates 2026,0,7,0,9.714285714285714
https://www.mothebroker.com/blog/asset-depletion-loans-guide-2026,asset depletion mortgage refinance or bank statement mortgage refinance 2026,0,6,0,4.333333333333334
https://www.mothebroker.com/blog/asset-depletion-loans-guide-2026,asset depletion mortgage requirements 2026,0,8,0,8.375
https://www.mothebroker.com/blog/asset-depletion-loans-guide-2026,fannie mae asset depletion guidelines 2026,0,13,0,7.461538461538462
https://www.mothebroker.com/blog/assumable-mortgage-loan-assumption-guide-2026,all va and fha loans are assumable without restriction,0,6,0,68.16666666666667
https://www.mothebroker.com/blog/assumable-mortgage-loan-assumption-guide-2026,are all fha loans assumable,0,2,0,91
https://www.mothebroker.com/blog/assumable-mortgage-loan-assumption-guide-2026,are all va loans assumable,0,7,0,81
https://www.mothebroker.com/blog/assumable-mortgage-loan-assumption-guide-2026,are all va loans assumable?,0,2,0,87
https://www.mothebroker.com/blog/assumable-mortgage-loan-assumption-guide-2026,are conventional mortgages assumable 2026,0,2,0,10
https://www.mothebroker.com/blog/assumable-mortgage-loan-assumption-guide-2026,assumable mortgage 2025 2026 current status va fha conventional,0,1,0,6
https://www.mothebroker.com/blog/assumable-mortgage-loan-assumption-guide-2026,assumable mortgage fha,0,1,0,50
https://www.mothebroker.com/blog/assumable-mortgage-loan-assumption-guide-2026,current mortgage assumption rules fha va conventional 2026,0,15,0,7.133333333333334
https://www.mothebroker.com/blog/assumable-mortgage-loan-assumption-guide-2026,fha assumable loan,0,1,0,95
https://www.mothebroker.com/blog/assumable-mortgage-loan-assumption-guide-2026,fha assumable loan requirements,0,1,0,44
https://www.mothebroker.com/blog/assumable-mortgage-loan-assumption-guide-2026,fha assumable loans,0,3,0,78.66666666666667
https://www.mothebroker.com/blog/assumable-mortgage-loan-assumption-guide-2026,fha assumable mortgage,0,2,0,64.5
https://www.mothebroker.com/blog/assumable-mortgage-loan-assumption-guide-2026,fha assumable mortgage guidelines,0,5,0,59.6
https://www.mothebroker.com/blog/assumable-mortgage-loan-assumption-guide-2026,fha assumption,0,2,0,60
https://www.mothebroker.com/blog/assumable-mortgage-loan-assumption-guide-2026,fha loan assumability,0,4,0,62.25
https://www.mothebroker.com/blog/assumable-mortgage-loan-assumption-guide-2026,fha loan assumability rules 2025 or 2026,0,2,0,7
https://www.mothebroker.com/blog/assumable-mortgage-loan-assumption-guide-2026,fha loan assumability rules 2026,0,6,0,8
https://www.mothebroker.com/blog/assumable-mortgage-loan-assumption-guide-2026,fha loan assumable,0,2,0,48.5
https://www.mothebroker.com/blog/assumable-mortgage-loan-assumption-guide-2026,fha loan assumption,0,2,0,53.5
https://www.mothebroker.com/blog/assumable-mortgage-loan-assumption-guide-2026,fha loan assumption process 2026,0,5,0,5.6
https://www.mothebroker.com/blog/assumable-mortgage-loan-assumption-guide-2026,fha loan assumption requirements 2026,0,3,0,9
https://www.mothebroker.com/blog/assumable-mortgage-loan-assumption-guide-2026,fha loans assumable,0,3,0,61.333333333333336
https://www.mothebroker.com/blog/assumable-mortgage-loan-assumption-guide-2026,va assumable mortgage guidelines,0,4,0,66.25
https://www.mothebroker.com/blog/assumable-mortgage-loan-assumption-guide-2026,va assumption notice,0,1,0,72
https://www.mothebroker.com/blog/assumable-mortgage-loan-assumption-guide-2026,va loan assumption,0,1,0,98
https://www.mothebroker.com/blog/assumable-mortgage-loan-assumption-guide-2026,va loan assumption process 2026,0,3,0,10
https://www.mothebroker.com/blog/assumable-mortgage-loan-assumption-guide-2026,va mortgage assumable,0,2,0,79.5
https://www.mothebroker.com/blog/bank-statement-loan-vs-w2-mortgage-2026,are bank statement loans a good idea 2025 or 2026,0,1,0,9
https://www.mothebroker.com/blog/bank-statement-loan-vs-w2-mortgage-2026,bank statement 2026,0,2,0,34.5
https://www.mothebroker.com/blog/bank-statement-loan-vs-w2-mortgage-2026,bank statement loan 2026,0,1,0,7
https://www.mothebroker.com/blog/bank-statement-loan-vs-w2-mortgage-2026,bank statement loan explained 2025 or 2026,0,1,0,9
https://www.mothebroker.com/blog/bank-statement-loan-vs-w2-mortgage-2026,bank statement loan explanation 2025 or 2026,0,4,0,8.25
https://www.mothebroker.com/blog/bank-statement-loan-vs-w2-mortgage-2026,bank statement loan qualification guidelines 2025 or 2026,0,3,0,9
https://www.mothebroker.com/blog/bank-statement-loan-vs-w2-mortgage-2026,bank statement loan rates 2026,0,1,0,10
https://www.mothebroker.com/blog/bank-statement-loan-vs-w2-mortgage-2026,bank statement loan requirements 2025 or 2026,0,2,0,9
https://www.mothebroker.com/blog/bank-statement-loan-vs-w2-mortgage-2026,bank statement loan requirements 2026,0,5,0,9.2
https://www.mothebroker.com/blog/bank-statement-loan-vs-w2-mortgage-2026,bank statement loans lenders 2026,0,3,0,9.333333333333334
https://www.mothebroker.com/blog/bank-statement-loan-vs-w2-mortgage-2026,bank statement mortgage loans current rates requirements 2026,0,3,0,8.666666666666668
https://www.mothebroker.com/blog/bank-statement-loan-vs-w2-mortgage-2026,do bank statement loans work for investment properties 2025 or 2026,0,1,0,7
https://www.mothebroker.com/blog/bank-statement-loan-vs-w2-mortgage-2026,mortgage underwriter overtime exemption missouri,0,6,0,6.333333333333333
https://www.mothebroker.com/blog/bank-statement-loan-vs-w2-mortgage-2026,why do mortgage lenders need w2,0,1,0,84
https://www.mothebroker.com/blog/bank-statement-loans-self-employed-2026,are bank statement loans a good idea 2025 or 2026,0,4,0,10
https://www.mothebroker.com/blog/bank-statement-loans-self-employed-2026,bank statement 2026,0,1,0,17
https://www.mothebroker.com/blog/bank-statement-loans-self-employed-2026,bank statement loan 2026,0,1,0,8
https://www.mothebroker.com/blog/bank-statement-loans-self-employed-2026,bank statement loan explanation 2025 or 2026,0,2,0,9.5
https://www.mothebroker.com/blog/bank-statement-loans-self-employed-2026,bank statement loan interest rates 2026,0,1,0,7
https://www.mothebroker.com/blog/bank-statement-loans-self-employed-2026,bank statement loan rates 2026,0,85,0,5.588235294117647
https://www.mothebroker.com/blog/bank-statement-loans-self-employed-2026,bank statement loan requirements 2026,0,3,0,9.666666666666666
https://www.mothebroker.com/blog/bank-statement-loans-self-employed-2026,bank statement loans california,0,1,0,54
https://www.mothebroker.com/blog/bank-statement-loans-self-employed-2026,bank statement loans for self-employed borrowers lenders 2026,0,4,0,17
https://www.mothebroker.com/blog/bank-statement-loans-self-employed-2026,bank statement loans irvine,0,1,0,47
https://www.mothebroker.com/blog/bank-statement-loans-self-employed-2026,bank statement loans lenders 2026,0,1,0,10
https://www.mothebroker.com/blog/bank-statement-loans-self-employed-2026,bank statement loans requirements 2026,0,3,0,9.666666666666666
https://www.mothebroker.com/blog/bank-statement-loans-self-employed-2026,best bank statement loan lenders 2026,0,22,0,8.045454545454547
https://www.mothebroker.com/blog/bank-statement-loans-self-employed-2026,best bank statement loan lenders for self-employed 2026,0,13,0,9.538461538461538
https://www.mothebroker.com/blog/bank-statement-loans-self-employed-2026,best bank statement loans for self-employed 2026,0,2,0,10
https://www.mothebroker.com/blog/bank-statement-loans-self-employed-2026,best bank statement mortgage lenders for self-employed 2026,0,21,0,14.047619047619047
https://www.mothebroker.com/blog/bank-statement-loans-self-employed-2026,best banks for self-employed mortgages 2025 2026,0,1,0,20
https://www.mothebroker.com/blog/bank-statement-loans-self-employed-2026,best banks for self-employed mortgages 2026,0,1,0,19
https://www.mothebroker.com/blog/bank-statement-loans-self-employed-2026,best lenders for bank statement mortgage 2025 2026,0,7,0,16.285714285714285
https://www.mothebroker.com/blog/bank-statement-loans-self-employed-2026,best lenders for bank statement mortgage 2025 or 2026,0,1,0,18
https://www.mothebroker.com/blog/bank-statement-loans-self-employed-2026,best lenders for self-employed borrowers 2025 2026,0,2,0,15.5
https://www.mothebroker.com/blog/bank-statement-loans-self-employed-2026,best lenders for self-employed borrowers 2025 or 2026,0,2,0,14.5
https://www.mothebroker.com/blog/bank-statement-loans-self-employed-2026,best lenders for self-employed borrowers 2026,0,7,0,17.428571428571427
https://www.mothebroker.com/blog/bank-statement-loans-self-employed-2026,best loan options for self-employed 2026,0,1,0,16
https://www.mothebroker.com/blog/bank-statement-loans-self-employed-2026,best mortgage lenders for self-employed 2026,0,2,0,18.5
https://www.mothebroker.com/blog/bank-statement-loans-self-employed-2026,california bank statement home mortgages,0,1,0,93
https://www.mothebroker.com/blog/bank-statement-loans-self-employed-2026,california bank statement mortgage lender,0,1,0,83
https://www.mothebroker.com/blog/bank-statement-loans-self-employed-2026,find lenders who allow bank-statement underwriting for self-employed engineers.,0,1,0,78
https://www.mothebroker.com/blog/bank-statement-loans-self-employed-2026,loans for self employed borrowers in california,0,1,0,25
https://www.mothebroker.com/blog/bank-statement-loans-self-employed-2026,loans for self employed borrowers in orange county ca,0,3,0,41.666666666666664
https://www.mothebroker.com/blog/bank-statement-loans-self-employed-2026,mothebroker.com,0,5,0,15.6
https://www.mothebroker.com/blog/bank-statement-loans-self-employed-2026,no doc loans for self-employed 2025 or 2026,0,3,0,10
https://www.mothebroker.com/blog/bank-statement-loans-self-employed-2026,personal loans for self-employed borrowers lenders 2026,0,4,0,19
https://www.mothebroker.com/blog/bank-statement-loans-self-employed-2026,personal loans no tax returns self-employed lenders 2026,0,25,0,8
https://www.mothebroker.com/blog/bank-statement-loans-self-employed-2026,self employed mortgage requirements 2026,0,1,0,9
https://www.mothebroker.com/blog/bank-statement-loans-self-employed-2026,self-employed mortgage lenders 2026,0,1,0,10
https://www.mothebroker.com/blog/bank-statement-loans-self-employed-2026,self-employed mortgage options 2026,0,1,0,18
https://www.mothebroker.com/blog/bank-statement-loans-self-employed-2026,self-employed mortgage without w-2 options 2026,0,3,0,9
https://www.mothebroker.com/blog/bank-statement-loans-self-employed-2026,top mortgage lenders for self-employed borrowers 2025 2026,0,4,0,17.75
https://www.mothebroker.com/blog/bank-statement-loans-self-employed-2026,what is a bank statement loan for self-employed 2026,0,1,0,10
https://www.mothebroker.com/blog/bank-statement-loans-wholesale,mothebroker.com,0,1,0,17
https://www.mothebroker.com/blog/bank-statement-loans-wholesale-2026,mothebroker.com,0,2,0,6
https://www.mothebroker.com/blog/bridge-loans-vs-dscr-investment-2026,best real estate bridge loan lenders 2025 2026 comparison,0,8,0,15.5
https://www.mothebroker.com/blog/bridge-loans-vs-dscr-investment-2026,bridge loans commercial real estate interest-only dscr,0,2,0,7
https://www.mothebroker.com/blog/bridge-loans-vs-dscr-investment-2026,bridge loans commercial real estate interest-only underwriting dscr,0,2,0,4
https://www.mothebroker.com/blog/bridge-loans-vs-dscr-investment-2026,construction bridge loan rates comparison different lenders terms conditions 2026,0,1,0,17
https://www.mothebroker.com/blog/bridge-loans-vs-dscr-investment-2026,dscr bridge loan,0,2,0,29
https://www.mothebroker.com/blog/calabasas-cash-out-refinance-2026,mothebroker.com,0,4,0,3.5
https://www.mothebroker.com/blog/cash-out-refinance-complete-guide-2026,3 day right of rescission calculator,0,2,0,82.5
https://www.mothebroker.com/blog/cash-out-refinance-complete-guide-2026,80 cash out refinance,0,1,0,75
https://www.mothebroker.com/blog/cash-out-refinance-complete-guide-2026,85 ltv cash out refinance,0,1,0,54
https://www.mothebroker.com/blog/cash-out-refinance-complete-guide-2026,95 ltv cash out refinance,0,2,0,93
https://www.mothebroker.com/blog/cash-out-refinance-complete-guide-2026,cash out loan to value for refinance,0,1,0,87
https://www.mothebroker.com/blog/cash-out-refinance-complete-guide-2026,cash out mortgage rules,0,1,0,91
https://www.mothebroker.com/blog/cash-out-refinance-complete-guide-2026,cash out refi 80 ltv,0,1,0,57
https://www.mothebroker.com/blog/cash-out-refinance-complete-guide-2026,cash out refi limits,0,3,0,76
https://www.mothebroker.com/blog/cash-out-refinance-complete-guide-2026,cash out refi loan to value,0,1,0,89
https://www.mothebroker.com/blog/cash-out-refinance-complete-guide-2026,cash out refi ltv,0,2,0,87
https://www.mothebroker.com/blog/cash-out-refinance-complete-guide-2026,cash out refi max ltv,0,1,0,95
https://www.mothebroker.com/blog/cash-out-refinance-complete-guide-2026,cash out refinance conventional loan,0,1,0,78
https://www.mothebroker.com/blog/cash-out-refinance-complete-guide-2026,cash out refinance guidelines,0,5,0,75
https://www.mothebroker.com/blog/cash-out-refinance-complete-guide-2026,cash out refinance jumbo loan,0,1,0,84
https://www.mothebroker.com/blog/cash-out-refinance-complete-guide-2026,cash out refinance limit,0,1,0,74
https://www.mothebroker.com/blog/cash-out-refinance-complete-guide-2026,cash out refinance loan to value,0,3,0,83.66666666666667
https://www.mothebroker.com/blog/cash-out-refinance-complete-guide-2026,cash out refinance ltv,0,10,0,78.3
https://www.mothebroker.com/blog/cash-out-refinance-complete-guide-2026,cash out refinance ltv limits,0,1,0,90
https://www.mothebroker.com/blog/cash-out-refinance-complete-guide-2026,cash out refinance max,0,2,0,76
https://www.mothebroker.com/blog/cash-out-refinance-complete-guide-2026,cash out refinance maximum,0,1,0,79
https://www.mothebroker.com/blog/cash-out-refinance-complete-guide-2026,cash out refinance maximum ltv,0,1,0,71
https://www.mothebroker.com/blog/cash-out-refinance-complete-guide-2026,cash out refinance process steps,0,1,0,6
https://www.mothebroker.com/blog/cash-out-refinance-complete-guide-2026,cash out refinance qualifications,0,3,0,95.33333333333333
https://www.mothebroker.com/blog/cash-out-refinance-complete-guide-2026,cash out refinance requirements,0,7,0,81.14285714285714
https://www.mothebroker.com/blog/cash-out-refinance-complete-guide-2026,cash out refinance rules,0,3,0,89.33333333333333
https://www.mothebroker.com/blog/cash-out-refinance-complete-guide-2026,cash out refinance waiting period,0,3,0,71.66666666666667
https://www.mothebroker.com/blog/cash-out-refinance-complete-guide-2026,cash-out refinance ltv limits,0,1,0,96
https://www.mothebroker.com/blog/cash-out-refinance-complete-guide-2026,cash-out refinance requirements,0,1,0,77
