page,query,clicks,impressions,ctr,position
https://www.mothebroker.com/blog/heloc-vs-personal-loan-home-improvement-2026,home equity loan vs personal loan interest rates comparison 2026,0,2,0,9.5
https://www.mothebroker.com/blog/heloc-vs-personal-loan-home-improvement-2026,home improvement loan vs home equity line of credit,0,2,0,70.5
https://www.mothebroker.com/blog/heloc-vs-personal-loan-home-improvement-2026,home improvement loan vs home equity loan,0,1,0,74
https://www.mothebroker.com/blog/heloc-vs-personal-loan-home-improvement-2026,home improvement loan vs personal loan,0,2,0,91
https://www.mothebroker.com/blog/heloc-vs-personal-loan-home-improvement-2026,home improvement personal loans vs home equity loans 2026,0,1,0,13
https://www.mothebroker.com/blog/heloc-vs-personal-loan-home-improvement-2026,home remodel loan rates vs heloc rates comparison 2026,0,5,0,7.4
https://www.mothebroker.com/blog/heloc-vs-personal-loan-home-improvement-2026,how do personal loan rates compare to using a heloc for a kitchen remodel right now?,0,1,0,12
https://www.mothebroker.com/blog/heloc-vs-personal-loan-home-improvement-2026,is a heloc better than a personal loan,0,18,0,84.77777777777777
https://www.mothebroker.com/blog/heloc-vs-personal-loan-home-improvement-2026,is it easier to get a personal loan for home improvement or personal loan,0,1,0,30
https://www.mothebroker.com/blog/heloc-vs-personal-loan-home-improvement-2026,online lenders vs traditional banks home improvement loan rates comparison 2025 or 2026,0,1,0,20
https://www.mothebroker.com/blog/heloc-vs-personal-loan-home-improvement-2026,online lenders vs traditional banks home improvement loan rates comparison 2026,0,1,0,20
https://www.mothebroker.com/blog/heloc-vs-personal-loan-home-improvement-2026,personal loan or heloc,0,5,0,83.8
https://www.mothebroker.com/blog/heloc-vs-personal-loan-home-improvement-2026,personal loan vs heloc comparison 2026,0,5,0,7
https://www.mothebroker.com/blog/heloc-vs-personal-loan-home-improvement-2026,personal loan vs heloc for home improvements 2026,0,89,0,7.449438202247191
https://www.mothebroker.com/blog/heloc-vs-personal-loan-home-improvement-2026,personal loan vs home equity loan comparison 2026,0,11,0,8.363636363636363
https://www.mothebroker.com/blog/heloc-vs-personal-loan-home-improvement-2026,personal loan vs home equity loan for home renovation 2026,0,11,0,7.818181818181818
https://www.mothebroker.com/blog/heloc-vs-personal-loan-home-improvement-2026,renovation loan vs heloc,0,2,0,84.5
https://www.mothebroker.com/blog/heloc-vs-personal-loan-home-improvement-2026,should i get a heloc for home improvements,0,1,0,87
https://www.mothebroker.com/blog/home-equity-affluent-marin-2026,what are the heloc requirements to access $50k in equity for a $400k vacation home?,0,4,0,11.25
https://www.mothebroker.com/blog/home-equity-affluent-suburban-east-bay-2026,fixed heloc lenders walnut creek ca,0,2,0,59.5
https://www.mothebroker.com/blog/home-equity-affluent-suburban-east-bay-2026,heloc danville,0,18,0,50.888888888888886
https://www.mothebroker.com/blog/home-equity-affluent-suburban-east-bay-2026,mothebroker.com,0,4,0,16.25
https://www.mothebroker.com/blog/home-equity-after-divorce-2026,equity buyout loan,0,1,0,51
https://www.mothebroker.com/blog/home-equity-after-divorce-2026,equity buyout refinance,0,1,0,25
https://www.mothebroker.com/blog/home-equity-after-divorce-2026,home equity divorce,0,1,0,71
https://www.mothebroker.com/blog/home-equity-after-divorce-2026,home equity loan divorce settlement,0,1,0,64
https://www.mothebroker.com/blog/home-equity-arcadia-ca-2026,home equity options los angeles,0,1,0,44
https://www.mothebroker.com/blog/home-equity-bay-area-peninsula-guide-2026,bay area equity to cash,0,1,0,43
https://www.mothebroker.com/blog/home-equity-bellevue-wa-2026,home equity loans bellevue,0,3,0,18
https://www.mothebroker.com/blog/home-equity-business-startup-funding-2026,can i use a heloc to start a business,0,1,0,54
https://www.mothebroker.com/blog/home-equity-business-startup-funding-2026,can you use a heloc to start a business,0,2,0,53
https://www.mothebroker.com/blog/home-equity-business-startup-funding-2026,heloc startup,0,1,0,18
https://www.mothebroker.com/blog/home-equity-business-startup-funding-2026,heloc to start a business,0,2,0,54
https://www.mothebroker.com/blog/home-equity-business-startup-funding-2026,home equity loan for business startup,0,3,0,36.333333333333336
https://www.mothebroker.com/blog/home-equity-business-startup-funding-2026,home equity loan for small business,0,1,0,97
https://www.mothebroker.com/blog/home-equity-business-startup-funding-2026,home equity loan to start a business,0,1,0,77
https://www.mothebroker.com/blog/home-equity-buy-second-home-vacation-2026,heloc on second home,0,1,0,85
https://www.mothebroker.com/blog/home-equity-buy-second-home-vacation-2026,mothebroker.com,0,2,0,3.5
https://www.mothebroker.com/blog/home-equity-ca-pv-a-2026,mothebroker.com,0,5,0,9.6
https://www.mothebroker.com/blog/home-equity-ca-pv-b-2026,home equity options los angeles,0,1,0,69
https://www.mothebroker.com/blog/home-equity-ca-pv-b-2026,mothebroker.com,0,4,0,9.75
https://www.mothebroker.com/blog/home-equity-calabasas-2026,investment properties in calabasas,0,2,0,61
https://www.mothebroker.com/blog/home-equity-central-coast-guide-2026,central coast home loans,0,1,0,25
https://www.mothebroker.com/blog/home-equity-central-coast-guide-2026,mothebroker.com,0,10,0,9.8
https://www.mothebroker.com/blog/home-equity-college-tuition-heloc-2026,parent plus loan vs heloc,0,2,0,29.5
https://www.mothebroker.com/blog/home-equity-coronado-2026,fha lenders coronado,0,2,0,81
https://www.mothebroker.com/blog/home-equity-for-renovations-2026,best home equity loans for major home renovations 2026,0,1,0,18
https://www.mothebroker.com/blog/home-equity-for-renovations-2026,heloc for home improvement,0,1,0,64
https://www.mothebroker.com/blog/home-equity-for-renovations-2026,heloc for home improvements,0,1,0,73
https://www.mothebroker.com/blog/home-equity-for-renovations-2026,heloc for renovation,0,1,0,78
https://www.mothebroker.com/blog/home-equity-for-renovations-2026,heloc for renovations,0,1,0,90
https://www.mothebroker.com/blog/home-equity-for-renovations-2026,home equity loan for remodel,0,2,0,73
https://www.mothebroker.com/blog/home-equity-for-renovations-2026,home equity loan for renovations,0,1,0,80
https://www.mothebroker.com/blog/home-equity-for-renovations-2026,home equity loan remodel,0,1,0,73
https://www.mothebroker.com/blog/home-equity-for-renovations-2026,mothebroker.com,0,1,0,15
https://www.mothebroker.com/blog/home-equity-for-renovations-2026,using home equity for renovations,0,1,0,76
https://www.mothebroker.com/blog/home-equity-for-renovations-2026,using home equity to renovate,0,1,0,72
https://www.mothebroker.com/blog/home-equity-greater-seattle-guide-2026,mothebroker.com,0,2,0,15
https://www.mothebroker.com/blog/home-equity-inland-empire-affluent-2026,heloc loan chino hills ca,0,1,0,28
https://www.mothebroker.com/blog/home-equity-inland-empire-affluent-2026,mothebroker.com,0,5,0,4
https://www.mothebroker.com/blog/home-equity-investment-property-down-payment-2026,can i use heloc for down payment on investment property,0,1,0,93
https://www.mothebroker.com/blog/home-equity-investment-property-down-payment-2026,heloc down payment investment property,0,1,0,100
https://www.mothebroker.com/blog/home-equity-investment-property-down-payment-2026,heloc for down payment on investment property,0,1,0,72
https://www.mothebroker.com/blog/home-equity-investment-property-down-payment-2026,home equity loan for down payment on investment property,0,1,0,40
https://www.mothebroker.com/blog/home-equity-investment-property-down-payment-2026,sbloc for down payment,0,1,0,79
https://www.mothebroker.com/blog/home-equity-investment-property-down-payment-2026,using home equity for down payment on investment property,0,3,0,62
https://www.mothebroker.com/blog/home-equity-irvine-2026,heloc irvine,0,1,0,46
https://www.mothebroker.com/blog/home-equity-kirkland-wa-2026,mothebroker.com,0,1,0,18
https://www.mothebroker.com/blog/home-equity-la-westside-beach-guide-2026,home renovations using equity manhattan,0,1,0,63
https://www.mothebroker.com/blog/home-equity-la-westside-luxury-2026,heloc culver city,0,2,0,26
https://www.mothebroker.com/blog/home-equity-laguna-beach-2026,mothebroker.com,0,1,0,11
https://www.mothebroker.com/blog/home-equity-loan-after-bankruptcy-california-2026,can a home equity loan be discharged in bankruptcy,0,2,0,91
https://www.mothebroker.com/blog/home-equity-loan-after-bankruptcy-california-2026,can i get a home equity loan after chapter 7,0,2,0,43
https://www.mothebroker.com/blog/home-equity-loan-after-bankruptcy-california-2026,can you get a home equity loan after chapter 7,0,2,0,57
https://www.mothebroker.com/blog/home-equity-loan-after-bankruptcy-california-2026,factors for heloc approval after bankruptcy,0,2,0,15
https://www.mothebroker.com/blog/home-equity-loan-after-bankruptcy-california-2026,hecm waiting period completion,0,1,0,58
https://www.mothebroker.com/blog/home-equity-loan-after-bankruptcy-california-2026,heloc after bankruptcy,0,4,0,54.5
https://www.mothebroker.com/blog/home-equity-loan-after-bankruptcy-california-2026,heloc after chapter 13 discharge,0,1,0,58
https://www.mothebroker.com/blog/home-equity-loan-after-bankruptcy-california-2026,home equity loan after bankruptcy,0,3,0,58
https://www.mothebroker.com/blog/home-equity-loan-after-bankruptcy-california-2026,home equity loan after chapter 7,0,1,0,67
https://www.mothebroker.com/blog/home-equity-loan-after-bankruptcy-california-2026,home equity loans bankruptcy,0,1,0,81
https://www.mothebroker.com/blog/home-equity-loan-after-bankruptcy-california-2026,how soon can i get a heloc after chapter 7,0,1,0,48
https://www.mothebroker.com/blog/home-equity-loan-after-bankruptcy-california-2026,waiting period for heloc after bankruptcy discharge,0,1,0,8
https://www.mothebroker.com/blog/home-equity-loan-after-bankruptcy-california-2026,waiting period for heloc after chapter 7 bankruptcy,0,1,0,10
https://www.mothebroker.com/blog/home-equity-loan-fixed-rate-2026,home equity loan explained 2026,0,1,0,15
https://www.mothebroker.com/blog/home-equity-loan-fixed-rate-2026,mothebroker.com,0,6,0,11.833333333333334
https://www.mothebroker.com/blog/home-equity-loan-vs-construction-loan-renovation-2026,construction loan vs heloc,0,1,0,30
https://www.mothebroker.com/blog/home-equity-loan-vs-construction-loan-renovation-2026,construction loan vs line of credit,0,1,0,55
https://www.mothebroker.com/blog/home-equity-loan-vs-construction-loan-renovation-2026,home equity loan vs heloc vs personal loan vs fha 203k for major renovations 2026,0,5,0,7.2
https://www.mothebroker.com/blog/home-equity-loan-vs-construction-loan-renovation-2026,renovation loan vs. construction loan,0,1,0,82
https://www.mothebroker.com/blog/home-equity-medical-expenses-financing-2026,reverse mortgage for medical expenses,0,1,0,30
https://www.mothebroker.com/blog/home-equity-mercer-island-2026,home equity line of credit mercer county,0,3,0,59.666666666666664
https://www.mothebroker.com/blog/home-equity-mercer-island-2026,mothebroker.com,0,1,0,16
https://www.mothebroker.com/blog/home-equity-newport-beach-2026,heloc newport beach,0,3,0,12.666666666666666
https://www.mothebroker.com/blog/home-equity-newport-beach-2026,home equity agreement companies near me,0,3,0,11
https://www.mothebroker.com/blog/home-equity-newport-beach-2026,home equity lines of credit newport beach,0,1,0,16
https://www.mothebroker.com/blog/home-equity-newport-beach-2026,mothebroker.com,0,2,0,8
https://www.mothebroker.com/blog/home-equity-north-sound-guide-2026,mothebroker.com,0,4,0,9.75
https://www.mothebroker.com/blog/home-equity-north-sound-guide-2026,north sound homes,0,1,0,12
https://www.mothebroker.com/blog/home-equity-north-sound-guide-2026,north sound investment property,0,5,0,16.6
https://www.mothebroker.com/blog/home-equity-north-sound-islands-wa-2026,mothebroker.com,0,1,0,7
https://www.mothebroker.com/blog/home-equity-pacific-palisades-ca-2026,home equity options los angeles,0,4,0,13.75
https://www.mothebroker.com/blog/home-equity-pasadena-corridor-2026,revolving credit line sierra madre ca,0,6,0,16.833333333333336
https://www.mothebroker.com/blog/home-equity-peninsula-ultra-luxury-2026,mothebroker.com,0,1,0,17
https://www.mothebroker.com/blog/home-equity-refinancing-guide-2026,mothebroker.com,0,1,0,4
https://www.mothebroker.com/blog/home-equity-retirement-income-strategy-2026,best home equity loan options for seniors 2026,0,1,0,18
https://www.mothebroker.com/blog/home-equity-retirement-income-strategy-2026,heloc for retirees,0,1,0,60
https://www.mothebroker.com/blog/home-equity-retirement-income-strategy-2026,using home equity for retirement income,0,2,0,83.5
https://www.mothebroker.com/blog/home-equity-retirement-income-strategy-2026,using your home equity for retirement income,0,7,0,91.57142857142857
https://www.mothebroker.com/blog/home-equity-sacramento-affluent-2026,mothebroker.com,0,3,0,9.333333333333334
https://www.mothebroker.com/blog/home-equity-sacramento-guide-2026,mothebroker.com,0,1,0,6
https://www.mothebroker.com/blog/home-equity-san-marino-ca-2026,revolving credit line san marino ca,0,7,0,16.57142857142857
https://www.mothebroker.com/blog/home-equity-santa-monica-ca-2026,heloc broker in los angeles,0,1,0,13
https://www.mothebroker.com/blog/home-equity-santa-monica-ca-2026,home equity options los angeles,0,2,0,50
https://www.mothebroker.com/blog/home-equity-sharing-vs-heloc-2026,best home equity sharing programs 2025 2026,0,10,0,11.1
https://www.mothebroker.com/blog/home-equity-sharing-vs-heloc-2026,equity sharing agreement,0,4,0,82
https://www.mothebroker.com/blog/home-equity-sharing-vs-heloc-2026,home equity share agreement,0,2,0,71.5
https://www.mothebroker.com/blog/home-equity-sharing-vs-heloc-2026,home equity sharing,0,10,0,75.7
https://www.mothebroker.com/blog/home-equity-sharing-vs-heloc-2026,home equity sharing agreement,0,2,0,92.5
https://www.mothebroker.com/blog/home-equity-sharing-vs-heloc-2026,home equity sharing agreements,0,3,0,85
https://www.mothebroker.com/blog/home-equity-sharing-vs-heloc-2026,home equity sharing agreements pros cons 2026,0,3,0,18
https://www.mothebroker.com/blog/home-equity-sharing-vs-heloc-2026,home equity sharing companies,0,5,0,78.2
https://www.mothebroker.com/blog/home-equity-sharing-vs-heloc-2026,shared equity vs heloc,0,3,0,10.666666666666666
https://www.mothebroker.com/blog/home-equity-sharing-vs-heloc-2026,yes please compare,0,1,0,6
https://www.mothebroker.com/blog/home-equity-south-sound-affluent-2026,mothebroker.com,0,6,0,13
https://www.mothebroker.com/blog/home-equity-south-sound-guide-2026,home equity extraction methods,0,1,0,10
https://www.mothebroker.com/blog/home-equity-south-sound-guide-2026,home equity line of credit tacoma,0,2,0,19
https://www.mothebroker.com/blog/home-equity-south-sound-guide-2026,mothebroker.com,0,5,0,13.6
https://www.mothebroker.com/blog/home-equity-suburban-king-county-2026,adu builders snoqualmie,0,1,0,95
https://www.mothebroker.com/blog/home-equity-suburban-king-county-2026,monthly payment on 1.4m heloc,0,1,0,30
https://www.mothebroker.com/blog/home-equity-suburban-king-county-2026,mothebroker.com,0,5,0,6.8
https://www.mothebroker.com/blog/home-equity-tax-deduction-2026,can interest on home equity loans be deducted,0,1,0,99
https://www.mothebroker.com/blog/home-equity-tax-deduction-2026,can you deduct home equity loan interest,0,1,0,97
https://www.mothebroker.com/blog/home-equity-tax-deduction-2026,heloc interest tax deductible 2026,0,1,0,30
https://www.mothebroker.com/blog/home-equity-tax-deduction-2026,heloc interest tax deduction rules 2026,0,2,0,8.5
https://www.mothebroker.com/blog/home-equity-tax-deduction-2026,home equity loan interest deduction 2026,0,1,0,8
https://www.mothebroker.com/blog/home-equity-tax-deduction-2026,home equity loan interest deduction tcja expiration,0,1,0,4
https://www.mothebroker.com/blog/home-equity-tax-deduction-2026,home equity loan tax deductible 2026,0,1,0,40
https://www.mothebroker.com/blog/home-equity-tax-deduction-2026,is home equity loan interest tax deductible for debt consolidation 2026,0,4,0,7
https://www.mothebroker.com/blog/home-equity-tax-deduction-2026,is interest on home equity loan deductible,0,1,0,97
https://www.mothebroker.com/blog/home-equity-tax-deduction-2026,is interest on home equity loans tax deductible,0,1,0,93
https://www.mothebroker.com/blog/home-equity-tax-deduction-2026,tcja expiration home equity interest deduction 2026,0,1,0,4
https://www.mothebroker.com/blog/home-equity-tax-deduction-2026,tcja home equity interest deduction expiration 2025 or 2026,0,3,0,6
https://www.mothebroker.com/blog/home-equity-tax-deduction-2026,tcja home equity interest deduction expiration 2026,0,2,0,4
https://www.mothebroker.com/blog/home-equity-tax-deduction-2026,tcja home equity loan interest deduction changes expiration,0,3,0,8.666666666666668
https://www.mothebroker.com/blog/home-equity-tax-deduction-2026,tcja home equity loan interest deduction expiration,0,4,0,8.5
https://www.mothebroker.com/blog/home-equity-tech-corridor-eastside-wa-2026,mothebroker.com,0,1,0,16
https://www.mothebroker.com/blog/home-equity-tech-corridor-silicon-valley-2026,mothebroker.com,0,1,0,8
https://www.mothebroker.com/blog/home-equity-urban-seattle-premium-2026,mothebroker.com,0,2,0,16
https://www.mothebroker.com/blog/home-equity-ventura-affluent-ca-2026,mothebroker.com,0,5,0,5.4
https://www.mothebroker.com/blog/home-equity-ventura-affluent-ca-2026,ventura county credit union heloc,0,1,0,61
https://www.mothebroker.com/blog/home-equity-ventura-county-guide-2026,"""bioatla"" | ""bioatla inc."" | ""bioatla.com""",0,2,0,9
https://www.mothebroker.com/blog/home-equity-ventura-county-guide-2026,mothebroker.com,0,2,0,15
https://www.mothebroker.com/blog/home-equity-washington-guide-2026,equity home loan washington,0,1,0,91
https://www.mothebroker.com/blog/home-equity-washington-guide-2026,heloc washington state,0,1,0,82
https://www.mothebroker.com/blog/home-equity-wine-country-2026,mothebroker.com,0,1,0,13
https://www.mothebroker.com/blog/home-equity-wine-country-guide-2026,mothebroker.com,0,9,0,11.777777777777779
https://www.mothebroker.com/blog/how-mortgage-brokers-get-paid-2026,borrower paid compensation,0,2,0,40
https://www.mothebroker.com/blog/how-mortgage-brokers-get-paid-2026,broker vs bank lo pay structure / per-loan earnings,0,7,0,9.714285714285714
https://www.mothebroker.com/blog/how-mortgage-brokers-get-paid-2026,higher comp for mortgage loan officers (broker channel),0,11,0,8.545454545454547
https://www.mothebroker.com/blog/how-mortgage-brokers-get-paid-2026,how do mortgage brokers get paid 2025 or 2026,0,33,0,2.393939393939394
https://www.mothebroker.com/blog/how-mortgage-brokers-get-paid-2026,how do mortgage brokers get wholesale rates 2026,0,3,0,7.333333333333333
https://www.mothebroker.com/blog/how-mortgage-brokers-get-paid-2026,how does a mortgage broker get paid,0,2,0,41
https://www.mothebroker.com/blog/how-mortgage-brokers-get-paid-2026,how mortgage brokers get paid,0,1,0,29
https://www.mothebroker.com/blog/how-mortgage-brokers-get-paid-2026,how much do mortgage brokers make per loan,0,2,0,27.5
https://www.mothebroker.com/blog/how-mortgage-brokers-get-paid-2026,"how much does a mortgage broker make on a $500,000 mortgage? explain how commission rates are set",0,1,0,3
https://www.mothebroker.com/blog/how-mortgage-brokers-get-paid-2026,"how much does a mortgage broker make on a $500,000 mortgage? tell me how lenders pay brokers",0,1,0,1
https://www.mothebroker.com/blog/how-mortgage-brokers-get-paid-2026,how much does mortgage broker make per loan,0,2,0,34.5
https://www.mothebroker.com/blog/how-mortgage-brokers-get-paid-2026,how to mortgage brokers get paid,0,2,0,43
https://www.mothebroker.com/blog/how-mortgage-brokers-get-paid-2026,imb broker model rates and compensation,0,1,0,18
https://www.mothebroker.com/blog/how-mortgage-brokers-get-paid-2026,mortgage broker commission,0,2,0,50
https://www.mothebroker.com/blog/how-mortgage-brokers-get-paid-2026,mortgage broker commission rates 2025 or 2026,0,2,0,5
https://www.mothebroker.com/blog/how-mortgage-brokers-get-paid-2026,mortgage broker commission rates 2026,0,15,0,2.4
https://www.mothebroker.com/blog/how-mortgage-brokers-get-paid-2026,mortgage broker compensation,0,2,0,36.5
https://www.mothebroker.com/blog/how-mortgage-brokers-get-paid-2026,mortgage broker compensation agreement,0,1,0,39
https://www.mothebroker.com/blog/how-mortgage-brokers-get-paid-2026,mortgage broker compensation explained 2025 or 2026,0,36,0,1.1666666666666667
https://www.mothebroker.com/blog/how-mortgage-brokers-get-paid-2026,mortgage broker compensation rules,0,2,0,24.5
https://www.mothebroker.com/blog/how-mortgage-brokers-get-paid-2026,mortgage broker compensation structure,0,2,0,18
https://www.mothebroker.com/blog/how-mortgage-brokers-get-paid-2026,mortgage specialist commission,0,1,0,88
https://www.mothebroker.com/blog/how-mortgage-brokers-get-paid-2026,typical mortgage broker fees costs 2025 2026,0,9,0,7.888888888888889
https://www.mothebroker.com/blog/how-mortgage-brokers-get-paid-2026,typical mortgage broker fees costs us 2025 2026,0,10,0,8.1
https://www.mothebroker.com/blog/how-mortgage-brokers-get-paid-2026,what commission do mortgage brokers make,0,1,0,89
https://www.mothebroker.com/blog/how-to-get-wholesale-mortgage-rates-2026,how do mortgage brokers get wholesale rates 2026,0,7,0,4.428571428571429
https://www.mothebroker.com/blog/how-to-get-wholesale-mortgage-rates-2026,mothebroker.com,0,4,0,7.75
https://www.mothebroker.com/blog/how-to-get-wholesale-mortgage-rates-2026,wholesale mortgage broker rate sheet,0,1,0,78
https://www.mothebroker.com/blog/how-to-get-wholesale-mortgage-rates-2026,wholesale mortgage rate sheets,0,1,0,68
https://www.mothebroker.com/blog/how-to-get-wholesale-mortgage-rates-2026,wholesale rate sheets,0,1,0,67
https://www.mothebroker.com/blog/interest-only-mortgage-loans-2026,"""interest only"" commercial mortgage underwriting ""fully amortizing"" or ""amortized payment""",0,5,0,6
https://www.mothebroker.com/blog/interest-only-mortgage-loans-2026,do commercial lenders underwrite io loans as fully amortizing,0,1,0,10
https://www.mothebroker.com/blog/interest-only-mortgage-loans-2026,do commercial mortgage underwriters qualify interest-only loans on fully amortized payment,0,1,0,18
https://www.mothebroker.com/blog/interest-only-mortgage-loans-2026,do commercial underwriters qualify io loans on amortizing payment,0,1,0,9
https://www.mothebroker.com/blog/interest-only-mortgage-loans-2026,do commercial underwriters qualify io loans on fully amortized payment,0,4,0,6.75
https://www.mothebroker.com/blog/interest-only-mortgage-loans-2026,do commercial underwriters qualify io loans on fully amortizing payment,0,5,0,7.4
https://www.mothebroker.com/blog/interest-only-mortgage-loans-2026,heloc with interest-only payments options 2026,0,3,0,4.666666666666666
https://www.mothebroker.com/blog/interest-only-mortgage-loans-2026,how does an interest only mortgage work,0,1,0,2
https://www.mothebroker.com/blog/interest-only-mortgage-loans-2026,interest mortgage only,0,1,0,1
https://www.mothebroker.com/blog/interest-only-mortgage-loans-2026,interest only jumbo mortgage loans,0,2,0,83.5
https://www.mothebroker.com/blog/interest-only-mortgage-loans-2026,interest only mortgage pros cons 2026,0,1,0,10
https://www.mothebroker.com/blog/irvine-mortgage-guide-2026,irvine mortgage,0,2,0,83
https://www.mothebroker.com/blog/jumbo-heloc-california-2026,typical heloc cltv limits 2026,0,3,0,16
https://www.mothebroker.com/blog/jumbo-heloc-california-2026,typical maximum cltv for heloc 2026,0,1,0,10
https://www.mothebroker.com/blog/jumbo-heloc-california-2026,verifycreditprofile.com,0,1,0,38
https://www.mothebroker.com/blog/jumbo-loan-refinance-california-2026,20 year jumbo refinance rates,0,2,0,78.5
https://www.mothebroker.com/blog/jumbo-loan-refinance-california-2026,how much is a jumbo loan in california,0,2,0,62
https://www.mothebroker.com/blog/jumbo-loan-refinance-california-2026,jumbo loan refinancing,0,3,0,82.66666666666667
https://www.mothebroker.com/blog/jumbo-loan-refinance-california-2026,jumbo loans refinance,0,2,0,74.5
https://www.mothebroker.com/blog/jumbo-loan-refinance-california-2026,jumbo loans refinancing,0,12,0,73.66666666666667
https://www.mothebroker.com/blog/jumbo-loan-refinance-california-2026,jumbo mortgage guidelines in california,0,1,0,42
https://www.mothebroker.com/blog/jumbo-loan-refinance-california-2026,jumbo mortgage refinance rates california,0,1,0,62
https://www.mothebroker.com/blog/jumbo-loan-refinance-california-2026,refinance jumbo loan rates california,0,1,0,64
https://www.mothebroker.com/blog/jumbo-loan-refinance-california-2026,san francisco jumbo loan limit,0,1,0,97
https://www.mothebroker.com/blog/jumbo-loan-refinance-california-2026,what is a jumbo loan california,0,1,0,66
https://www.mothebroker.com/blog/jumbo-loan-refinance-california-2026,what is a jumbo loan in california,0,3,0,70.33333333333333
https://www.mothebroker.com/blog/jumbo-loan-refinance-california-2026,what is considered a jumbo loan in california,0,3,0,82
https://www.mothebroker.com/blog/jumbo-loan-refinance-california-2026,what is jumbo loan in california,0,3,0,67
https://www.mothebroker.com/blog/jumbo-loan-refinance-california-2026,what's considered a jumbo loan in california,0,4,0,75.25
https://www.mothebroker.com/blog/jumbo-loan-requirements-california-washington-2026,ca jumbo loan,0,1,0,79
https://www.mothebroker.com/blog/jumbo-loan-requirements-california-washington-2026,ca jumbo loan amount,0,1,0,64
https://www.mothebroker.com/blog/jumbo-loan-requirements-california-washington-2026,california jumbo loan,0,3,0,91.33333333333333
