page,query,clicks,impressions,ctr,position
https://www.mothebroker.com/tools/property-tax-estimator,california property tax calculator,0,1,0,73
https://www.mothebroker.com/tools/property-tax-estimator,how much is property tax in california 2025,0,1,0,89
https://www.mothebroker.com/tools/property-tax-estimator,property tax calculator california,0,2,0,62.5
https://www.mothebroker.com/tools/property-tax-estimator,property tax estimator,0,1,0,8
https://www.mothebroker.com/tools/property-tax-estimator,property tax rate in temecula ca,0,1,0,74
https://www.mothebroker.com/tools/property-tax-estimator,surrey property tax calculator,0,1,0,20
https://www.mothebroker.com/tools/property-tax-estimator/ca/alameda-county/fremont,fremont ca property tax rate,0,5,0,9.4
https://www.mothebroker.com/tools/property-tax-estimator/ca/alameda-county/fremont,fremont ca property tax rate 2025,0,1,0,9
https://www.mothebroker.com/tools/property-tax-estimator/ca/alameda-county/fremont,fremont ca property tax rate 2026,0,33,0,5.545454545454546
https://www.mothebroker.com/tools/property-tax-estimator/ca/alameda-county/fremont,fremont property tax,0,3,0,10
https://www.mothebroker.com/tools/property-tax-estimator/ca/alameda-county/fremont,fremont property tax rate,0,8,0,10.75
https://www.mothebroker.com/tools/property-tax-estimator/ca/alameda-county/fremont,fremont property taxes,0,2,0,9
https://www.mothebroker.com/tools/property-tax-estimator/ca/alameda-county/fremont,property tax in fremont ca,0,1,0,10
https://www.mothebroker.com/tools/property-tax-estimator/ca/alameda-county/fremont,property tax on 200k home,0,2,0,10.5
https://www.mothebroker.com/tools/property-tax-estimator/ca/alameda-county/fremont,property tax rate fremont ca,0,2,0,9.5
https://www.mothebroker.com/tools/property-tax-estimator/ca/alameda-county/fremont,tax rate in fremont ca,0,1,0,42
https://www.mothebroker.com/tools/property-tax-estimator/ca/butte-county,butte county ca property tax rate 2026,0,10,0,3.7
https://www.mothebroker.com/tools/property-tax-estimator/ca/butte-county,butte county property tax,0,1,0,47
https://www.mothebroker.com/tools/property-tax-estimator/ca/butte-county,butte county property tax rate,0,2,0,11.5
https://www.mothebroker.com/tools/property-tax-estimator/ca/butte-county,butte county property taxes,0,1,0,28
https://www.mothebroker.com/tools/property-tax-estimator/ca/butte-county,butte county tax,0,1,0,38
https://www.mothebroker.com/tools/property-tax-estimator/ca/butte-county,butte property taxes,0,2,0,12
https://www.mothebroker.com/tools/property-tax-estimator/ca/butte-county,property tax butte county,0,1,0,33
https://www.mothebroker.com/tools/property-tax-estimator/ca/butte-county,property taxes butte county,0,2,0,20.5
https://www.mothebroker.com/tools/property-tax-estimator/ca/colusa-county,california property tax calculator,0,3,0,81.33333333333333
https://www.mothebroker.com/tools/property-tax-estimator/ca/colusa-county,property tax calculator california,0,1,0,85
https://www.mothebroker.com/tools/property-tax-estimator/ca/contra-costa-county,contra costa county property tax rate 2026,0,2,0,9.5
https://www.mothebroker.com/tools/property-tax-estimator/ca/contra-costa-county,contra costa county transfer tax,0,1,0,86
https://www.mothebroker.com/tools/property-tax-estimator/ca/contra-costa-county,contra costa tax rate,0,1,0,79
https://www.mothebroker.com/tools/property-tax-estimator/ca/contra-costa-county,property tax calculator contra costa county,0,1,0,11
https://www.mothebroker.com/tools/property-tax-estimator/ca/contra-costa-county,property tax rate contra costa county ca 2026,0,1,0,8
https://www.mothebroker.com/tools/property-tax-estimator/ca/contra-costa-county,property tax walnut creek ca,0,2,0,19
https://www.mothebroker.com/tools/property-tax-estimator/ca/contra-costa-county/danville,contra costa county property tax rate,0,3,0,41.333333333333336
https://www.mothebroker.com/tools/property-tax-estimator/ca/contra-costa-county/danville,danville ca property tax,0,3,0,10.666666666666666
https://www.mothebroker.com/tools/property-tax-estimator/ca/contra-costa-county/danville,danville ca property tax rate 2026,0,11,0,1.5454545454545454
https://www.mothebroker.com/tools/property-tax-estimator/ca/contra-costa-county/danville,danville ca sales tax,0,1,0,20
https://www.mothebroker.com/tools/property-tax-estimator/ca/contra-costa-county/danville,danville ca tax rate,0,1,0,11
https://www.mothebroker.com/tools/property-tax-estimator/ca/contra-costa-county/danville,danville property tax,0,10,0,10
https://www.mothebroker.com/tools/property-tax-estimator/ca/contra-costa-county/danville,danville property tax rate,0,1,0,4
https://www.mothebroker.com/tools/property-tax-estimator/ca/contra-costa-county/danville,danville tax rate,0,1,0,31
https://www.mothebroker.com/tools/property-tax-estimator/ca/contra-costa-county/danville,how much is property tax in contra costa county,0,3,0,30
https://www.mothebroker.com/tools/property-tax-estimator/ca/contra-costa-county/danville,property tax danville,0,6,0,10.5
https://www.mothebroker.com/tools/property-tax-estimator/ca/contra-costa-county/danville,property tax danville ca,0,2,0,11.5
https://www.mothebroker.com/tools/property-tax-estimator/ca/contra-costa-county/danville,property tax rate in contra costa county,0,2,0,44
https://www.mothebroker.com/tools/property-tax-estimator/ca/contra-costa-county/danville,what is the property tax on a 2 million dollar home,0,1,0,12
https://www.mothebroker.com/tools/property-tax-estimator/ca/contra-costa-county/lafayette,lafayette property taxes,0,2,0,10
https://www.mothebroker.com/tools/property-tax-estimator/ca/contra-costa-county/lafayette,property tax calculator contra costa county,0,2,0,59
https://www.mothebroker.com/tools/property-tax-estimator/ca/contra-costa-county/lafayette,property tax rate in contra costa county,0,1,0,13
https://www.mothebroker.com/tools/property-tax-estimator/ca/contra-costa-county/san-ramon,how much is property tax in contra costa county,0,3,0,47.666666666666664
https://www.mothebroker.com/tools/property-tax-estimator/ca/contra-costa-county/san-ramon,property tax san ramon,0,5,0,9.2
https://www.mothebroker.com/tools/property-tax-estimator/ca/contra-costa-county/san-ramon,san ramon ca property tax,0,1,0,10
https://www.mothebroker.com/tools/property-tax-estimator/ca/contra-costa-county/san-ramon,san ramon property tax,0,5,0,15.2
https://www.mothebroker.com/tools/property-tax-estimator/ca/contra-costa-county/san-ramon,san ramon property tax rate,0,4,0,6.25
https://www.mothebroker.com/tools/property-tax-estimator/ca/contra-costa-county/san-ramon,what is the property tax on a 2 million dollar home,0,1,0,1
https://www.mothebroker.com/tools/property-tax-estimator/ca/contra-costa-county/walnut-creek,contra costa county property tax rate,0,1,0,35
https://www.mothebroker.com/tools/property-tax-estimator/ca/contra-costa-county/walnut-creek,how much is property tax in contra costa county,0,1,0,32
https://www.mothebroker.com/tools/property-tax-estimator/ca/contra-costa-county/walnut-creek,walnut creek ca property tax rate 2026,0,4,0,4
https://www.mothebroker.com/tools/property-tax-estimator/ca/contra-costa-county/walnut-creek,walnut creek property tax,0,3,0,18
https://www.mothebroker.com/tools/property-tax-estimator/ca/contra-costa-county/walnut-creek,walnut creek property tax rate,0,2,0,6
https://www.mothebroker.com/tools/property-tax-estimator/ca/del-norte-county,california property tax calculator,0,3,0,74.66666666666667
https://www.mothebroker.com/tools/property-tax-estimator/ca/del-norte-county,irvine ca property tax rate,0,1,0,91
https://www.mothebroker.com/tools/property-tax-estimator/ca/del-norte-county,la property tax calculator,0,1,0,89
https://www.mothebroker.com/tools/property-tax-estimator/ca/del-norte-county,property tax calculator orange county,0,1,0,81
https://www.mothebroker.com/tools/property-tax-estimator/ca/del-norte-county,property tax in corona ca,0,1,0,96
https://www.mothebroker.com/tools/property-tax-estimator/ca/del-norte-county,property tax orange county calculator,0,1,0,83
https://www.mothebroker.com/tools/property-tax-estimator/ca/del-norte-county,property tax rate orange county california,0,1,0,90
https://www.mothebroker.com/tools/property-tax-estimator/ca/fresno-county/fresno,fresno ca property tax,0,2,0,72.5
https://www.mothebroker.com/tools/property-tax-estimator/ca/fresno-county/fresno,fresno ca property tax rate 2026,0,35,0,3.7714285714285714
https://www.mothebroker.com/tools/property-tax-estimator/ca/fresno-county/fresno,fresno county ca property tax rate 2026,0,8,0,5.75
https://www.mothebroker.com/tools/property-tax-estimator/ca/fresno-county/fresno,fresno county property tax rate 2026,0,13,0,5.615384615384615
https://www.mothebroker.com/tools/property-tax-estimator/ca/fresno-county/fresno,fresno property tax,0,5,0,34.8
https://www.mothebroker.com/tools/property-tax-estimator/ca/fresno-county/fresno,fresno property tax rate,0,1,0,10
https://www.mothebroker.com/tools/property-tax-estimator/ca/fresno-county/fresno,how much is property tax,0,1,0,11
https://www.mothebroker.com/tools/property-tax-estimator/ca/fresno-county/fresno,how much is property tax on a 500k house,0,1,0,7
https://www.mothebroker.com/tools/property-tax-estimator/ca/fresno-county/fresno,property tax rate fresno county ca 2026,0,2,0,5.5
https://www.mothebroker.com/tools/property-tax-estimator/ca/humboldt-county,california property tax calculator,0,1,0,85
https://www.mothebroker.com/tools/property-tax-estimator/ca/humboldt-county,how much will i pay in property taxes,0,1,0,13
https://www.mothebroker.com/tools/property-tax-estimator/ca/imperial-county,california property tax calculator,0,5,0,85.4
https://www.mothebroker.com/tools/property-tax-estimator/ca/imperial-county,imperial county ca tax assessor,0,2,0,46
https://www.mothebroker.com/tools/property-tax-estimator/ca/imperial-county,imperial county property taxes,0,2,0,38
https://www.mothebroker.com/tools/property-tax-estimator/ca/imperial-county,property tax calculator california,0,1,0,86
https://www.mothebroker.com/tools/property-tax-estimator/ca/kern-county,kern county california property tax rate 2026,0,6,0,4.833333333333334
https://www.mothebroker.com/tools/property-tax-estimator/ca/kern-county,kern county property tax,0,2,0,43
https://www.mothebroker.com/tools/property-tax-estimator/ca/kern-county,kern county property tax rate 2026,0,5,0,4.6
https://www.mothebroker.com/tools/property-tax-estimator/ca/kern-county,kern county tax rate,0,1,0,49
https://www.mothebroker.com/tools/property-tax-estimator/ca/kern-county,kern county taxes property,0,1,0,65
https://www.mothebroker.com/tools/property-tax-estimator/ca/kern-county/bakersfield,bakersfield ca property tax rate 2026,0,11,0,4.545454545454545
https://www.mothebroker.com/tools/property-tax-estimator/ca/kern-county/bakersfield,bakersfield ca tax rate,0,1,0,63
https://www.mothebroker.com/tools/property-tax-estimator/ca/kern-county/bakersfield,bakersfield property tax,0,1,0,24
https://www.mothebroker.com/tools/property-tax-estimator/ca/kern-county/bakersfield,kern county ca property tax rate 2026,0,1,0,9
https://www.mothebroker.com/tools/property-tax-estimator/ca/kern-county/bakersfield,kern county property tax rate 2026,0,3,0,8
https://www.mothebroker.com/tools/property-tax-estimator/ca/kern-county/bakersfield,property tax rate bakersfield ca,0,2,0,10
https://www.mothebroker.com/tools/property-tax-estimator/ca/kern-county/bakersfield,tax in bakersfield ca,0,1,0,49
https://www.mothebroker.com/tools/property-tax-estimator/ca/lake-county,ca property tax calculator,0,1,0,64
https://www.mothebroker.com/tools/property-tax-estimator/ca/lake-county,california property tax calculator,0,11,0,65.45454545454545
https://www.mothebroker.com/tools/property-tax-estimator/ca/lake-county,how much is property tax in california calculator,0,1,0,80
https://www.mothebroker.com/tools/property-tax-estimator/ca/lake-county,lake county california property tax,0,1,0,23
https://www.mothebroker.com/tools/property-tax-estimator/ca/lake-county,lake county property tax calculator,0,1,0,37
https://www.mothebroker.com/tools/property-tax-estimator/ca/lake-county,lake county tax percentage,0,1,0,11
https://www.mothebroker.com/tools/property-tax-estimator/ca/lake-county,lake county tax rate,0,1,0,69
https://www.mothebroker.com/tools/property-tax-estimator/ca/lake-county,property tax calculator california,0,3,0,65.33333333333333
https://www.mothebroker.com/tools/property-tax-estimator/ca/lake-county,property tax california calculator,0,2,0,65
https://www.mothebroker.com/tools/property-tax-estimator/ca/lake-county,property tax lake county ca,0,2,0,48.5
https://www.mothebroker.com/tools/property-tax-estimator/ca/lake-county,property taxes california calculator,0,1,0,62
https://www.mothebroker.com/tools/property-tax-estimator/ca/los-angeles-county,annual property tax calculator,0,1,0,63
https://www.mothebroker.com/tools/property-tax-estimator/ca/los-angeles-county,average effective property tax rate los angeles county 2026,0,2,0,4.5
https://www.mothebroker.com/tools/property-tax-estimator/ca/los-angeles-county,average property tax rate los angeles county 2026,0,7,0,5
https://www.mothebroker.com/tools/property-tax-estimator/ca/los-angeles-county,average property tax rate los angeles county ca 2026,0,1,0,6
https://www.mothebroker.com/tools/property-tax-estimator/ca/los-angeles-county,average property tax rate los angeles county california 2026,0,4,0,3.75
https://www.mothebroker.com/tools/property-tax-estimator/ca/los-angeles-county,burbank ca property tax rate 2026,0,20,0,7.85
https://www.mothebroker.com/tools/property-tax-estimator/ca/los-angeles-county,california property tax calculator,0,2,0,59.5
https://www.mothebroker.com/tools/property-tax-estimator/ca/los-angeles-county,effective property tax rate los angeles county 2026,0,1,0,8
https://www.mothebroker.com/tools/property-tax-estimator/ca/los-angeles-county,effective property tax rate redondo beach california 2024 or 2025,0,1,0,10
https://www.mothebroker.com/tools/property-tax-estimator/ca/los-angeles-county,estimate annual property tax,0,1,0,58
https://www.mothebroker.com/tools/property-tax-estimator/ca/los-angeles-county,how much are property taxes in los angeles,0,1,0,69
https://www.mothebroker.com/tools/property-tax-estimator/ca/los-angeles-county,la county property tax rate,0,1,0,65
https://www.mothebroker.com/tools/property-tax-estimator/ca/los-angeles-county,la property tax calculator,0,1,0,59
https://www.mothebroker.com/tools/property-tax-estimator/ca/los-angeles-county,los angeles county average effective property tax rate 2025,0,1,0,18
https://www.mothebroker.com/tools/property-tax-estimator/ca/los-angeles-county,los angeles county average effective property tax rate 2025 2026,0,1,0,6
https://www.mothebroker.com/tools/property-tax-estimator/ca/los-angeles-county,los angeles county average effective property tax rate 2026,0,2,0,5
https://www.mothebroker.com/tools/property-tax-estimator/ca/los-angeles-county,los angeles county average property tax rate 2026,0,2,0,4
https://www.mothebroker.com/tools/property-tax-estimator/ca/los-angeles-county,los angeles county effective property tax rate 2026,0,12,0,6.75
https://www.mothebroker.com/tools/property-tax-estimator/ca/los-angeles-county,los angeles county property tax rate 2025 or 2026 effective rate,0,1,0,10
https://www.mothebroker.com/tools/property-tax-estimator/ca/los-angeles-county,los angeles county property tax rate 2026,0,7,0,9
https://www.mothebroker.com/tools/property-tax-estimator/ca/los-angeles-county,los angeles county property tax rate 2026 effective rate,0,6,0,5.166666666666667
https://www.mothebroker.com/tools/property-tax-estimator/ca/los-angeles-county,los angeles property tax calculator,0,3,0,58.333333333333336
https://www.mothebroker.com/tools/property-tax-estimator/ca/los-angeles-county,los angeles property tax rate,0,1,0,83
https://www.mothebroker.com/tools/property-tax-estimator/ca/los-angeles-county,los angeles property tax rate 2026 average,0,2,0,8
https://www.mothebroker.com/tools/property-tax-estimator/ca/los-angeles-county,los angeles transfer tax calculator,0,3,0,86.66666666666667
https://www.mothebroker.com/tools/property-tax-estimator/ca/los-angeles-county,monthly property tax calculator,0,1,0,55
https://www.mothebroker.com/tools/property-tax-estimator/ca/los-angeles-county,property tax calculator california,0,1,0,59
https://www.mothebroker.com/tools/property-tax-estimator/ca/los-angeles-county,property tax calculator orange county,0,1,0,83
https://www.mothebroker.com/tools/property-tax-estimator/ca/los-angeles-county,property tax estimator,0,1,0,49
https://www.mothebroker.com/tools/property-tax-estimator/ca/los-angeles-county,property tax for a 300k house,0,1,0,12
https://www.mothebroker.com/tools/property-tax-estimator/ca/los-angeles-county,property tax in beverly hills,0,1,0,59
https://www.mothebroker.com/tools/property-tax-estimator/ca/los-angeles-county,property tax rate beverly hills ca,0,1,0,9
https://www.mothebroker.com/tools/property-tax-estimator/ca/los-angeles-county,property tax rate los angeles county 2026,0,2,0,7.5
https://www.mothebroker.com/tools/property-tax-estimator/ca/los-angeles-county,property tax rate los angeles county california 2026,0,2,0,8.5
https://www.mothebroker.com/tools/property-tax-estimator/ca/los-angeles-county,property tax rates in california by city,0,1,0,87
https://www.mothebroker.com/tools/property-tax-estimator/ca/los-angeles-county,redondo beach ca property tax rate 2025 or 2026,0,2,0,7
https://www.mothebroker.com/tools/property-tax-estimator/ca/los-angeles-county,redondo beach ca property tax rate 2026,0,6,0,5.666666666666667
https://www.mothebroker.com/tools/property-tax-estimator/ca/los-angeles-county,what is los angeles county property tax rate,0,1,0,67
https://www.mothebroker.com/tools/property-tax-estimator/ca/los-angeles-county,what is the property tax rate for los angeles county,0,1,0,61
https://www.mothebroker.com/tools/property-tax-estimator/ca/los-angeles-county,what is the property tax rate in los angeles county,0,1,0,69
https://www.mothebroker.com/tools/property-tax-estimator/ca/los-angeles-county,whittier ca property tax rate,0,1,0,9
https://www.mothebroker.com/tools/property-tax-estimator/ca/los-angeles-county,whittier property tax rate,0,1,0,12
https://www.mothebroker.com/tools/property-tax-estimator/ca/los-angeles-county/alhambra,alhambra property tax,0,1,0,12
https://www.mothebroker.com/tools/property-tax-estimator/ca/los-angeles-county/alhambra,alhambra property tax rate,0,1,0,7
https://www.mothebroker.com/tools/property-tax-estimator/ca/los-angeles-county/alhambra,alhambra tax rate,0,2,0,26.5
https://www.mothebroker.com/tools/property-tax-estimator/ca/los-angeles-county/alhambra,how much are property taxes,0,1,0,5
https://www.mothebroker.com/tools/property-tax-estimator/ca/los-angeles-county/alhambra,property tax how much,0,1,0,5
https://www.mothebroker.com/tools/property-tax-estimator/ca/los-angeles-county/calabasas,property tax percentage,0,1,0,13
https://www.mothebroker.com/tools/property-tax-estimator/ca/los-angeles-county/carson,how much is monthly property tax,0,1,0,5
https://www.mothebroker.com/tools/property-tax-estimator/ca/los-angeles-county/carson,tax rate in carson ca,0,1,0,32
https://www.mothebroker.com/tools/property-tax-estimator/ca/los-angeles-county/cerritos,la property tax calculator,0,1,0,86
https://www.mothebroker.com/tools/property-tax-estimator/ca/los-angeles-county/cerritos,los angeles property tax calculator,0,2,0,90.5
https://www.mothebroker.com/tools/property-tax-estimator/ca/los-angeles-county/cerritos,sales tax for cerritos ca,0,1,0,78
https://www.mothebroker.com/tools/property-tax-estimator/ca/los-angeles-county/el-monte,el monte property tax,0,1,0,8
https://www.mothebroker.com/tools/property-tax-estimator/ca/los-angeles-county/el-monte,el monte property tax rate,0,6,0,6.333333333333333
https://www.mothebroker.com/tools/property-tax-estimator/ca/los-angeles-county/el-monte,el monte tax,0,1,0,31
https://www.mothebroker.com/tools/property-tax-estimator/ca/los-angeles-county/el-monte,el monte tax rate,0,1,0,45
https://www.mothebroker.com/tools/property-tax-estimator/ca/los-angeles-county/el-monte,la property tax calculator,0,1,0,85
https://www.mothebroker.com/tools/property-tax-estimator/ca/los-angeles-county/el-monte,los angeles property tax calculator,0,1,0,96
https://www.mothebroker.com/tools/property-tax-estimator/ca/los-angeles-county/hawthorne,hawthorne tax rate,0,1,0,21
https://www.mothebroker.com/tools/property-tax-estimator/ca/los-angeles-county/hermosa-beach,la property tax calculator,0,1,0,84
https://www.mothebroker.com/tools/property-tax-estimator/ca/los-angeles-county/inglewood,inglewood property tax rate,0,2,0,8
https://www.mothebroker.com/tools/property-tax-estimator/ca/los-angeles-county/inglewood,los angeles property tax calculator,0,1,0,91
https://www.mothebroker.com/tools/property-tax-estimator/ca/los-angeles-county/long-beach,ca property tax calculator,0,1,0,81
https://www.mothebroker.com/tools/property-tax-estimator/ca/los-angeles-county/long-beach,calculate property tax,0,1,0,8
https://www.mothebroker.com/tools/property-tax-estimator/ca/los-angeles-county/long-beach,estimated annual property taxes by zip code,0,1,0,11
https://www.mothebroker.com/tools/property-tax-estimator/ca/los-angeles-county/long-beach,how.much is property tax,0,1,0,11
https://www.mothebroker.com/tools/property-tax-estimator/ca/los-angeles-county/long-beach,la property tax calculator,0,1,0,87
https://www.mothebroker.com/tools/property-tax-estimator/ca/los-angeles-county/long-beach,long beach ca effective property tax rate 2026,0,6,0,4.833333333333334
https://www.mothebroker.com/tools/property-tax-estimator/ca/los-angeles-county/long-beach,long beach ca property tax rate 2025 or 2026,0,3,0,7
https://www.mothebroker.com/tools/property-tax-estimator/ca/los-angeles-county/long-beach,long beach ca property tax rate 2026,0,36,0,2.833333333333333
https://www.mothebroker.com/tools/property-tax-estimator/ca/los-angeles-county/long-beach,long beach ca tax rate,0,1,0,42
https://www.mothebroker.com/tools/property-tax-estimator/ca/los-angeles-county/long-beach,long beach property tax,0,2,0,45
https://www.mothebroker.com/tools/property-tax-estimator/ca/los-angeles-county/long-beach,long beach property tax rate,0,2,0,9
https://www.mothebroker.com/tools/property-tax-estimator/ca/los-angeles-county/long-beach,long beach property taxes,0,1,0,24
https://www.mothebroker.com/tools/property-tax-estimator/ca/los-angeles-county/long-beach,long beach tax rate,0,4,0,46.25
https://www.mothebroker.com/tools/property-tax-estimator/ca/los-angeles-county/long-beach,los angeles county property tax rate 2026 effective rate,0,1,0,12
https://www.mothebroker.com/tools/property-tax-estimator/ca/los-angeles-county/long-beach,los angeles property tax calculator,0,4,0,79.5
https://www.mothebroker.com/tools/property-tax-estimator/ca/los-angeles-county/long-beach,property tax calculator california,0,2,0,85
https://www.mothebroker.com/tools/property-tax-estimator/ca/los-angeles-county/long-beach,property tax california calculator,0,2,0,85.5
https://www.mothebroker.com/tools/property-tax-estimator/ca/los-angeles-county/long-beach,property tax estimator,0,2,0,8.5
https://www.mothebroker.com/tools/property-tax-estimator/ca/los-angeles-county/long-beach,property tax in long beach ca,0,1,0,6
https://www.mothebroker.com/tools/property-tax-estimator/ca/los-angeles-county/long-beach,property tax rate long beach ca,0,4,0,8
https://www.mothebroker.com/tools/property-tax-estimator/ca/los-angeles-county/long-beach,property tax rate long beach ca 2026,0,8,0,4.625
https://www.mothebroker.com/tools/property-tax-estimator/ca/los-angeles-county/long-beach,property taxes california calculator,0,1,0,86
https://www.mothebroker.com/tools/property-tax-estimator/ca/los-angeles-county/long-beach,tax rate long beach ca,0,1,0,43
https://www.mothebroker.com/tools/property-tax-estimator/ca/los-angeles-county/los-angeles,average property tax rate los angeles ca 2026,0,1,0,10
https://www.mothebroker.com/tools/property-tax-estimator/ca/los-angeles-county/los-angeles,average property tax rate los angeles county 2026,0,25,0,9.28
https://www.mothebroker.com/tools/property-tax-estimator/ca/los-angeles-county/los-angeles,average property tax rate los angeles county california 2026,0,3,0,10.333333333333334
https://www.mothebroker.com/tools/property-tax-estimator/ca/los-angeles-county/los-angeles,california property tax calculator,0,1,0,76
https://www.mothebroker.com/tools/property-tax-estimator/ca/los-angeles-county/los-angeles,california property tax rate los angeles county 2026,0,9,0,8.777777777777779
https://www.mothebroker.com/tools/property-tax-estimator/ca/los-angeles-county/los-angeles,effective property tax rate los angeles county 2026,0,2,0,10
https://www.mothebroker.com/tools/property-tax-estimator/ca/los-angeles-county/los-angeles,estimated property taxes calculator,0,1,0,38
https://www.mothebroker.com/tools/property-tax-estimator/ca/los-angeles-county/los-angeles,la property tax calculator,0,1,0,68
https://www.mothebroker.com/tools/property-tax-estimator/ca/los-angeles-county/los-angeles,los angeles county average effective property tax rate 2025 2026,0,1,0,12
https://www.mothebroker.com/tools/property-tax-estimator/ca/los-angeles-county/los-angeles,los angeles county average effective property tax rate 2026,0,5,0,9.8
https://www.mothebroker.com/tools/property-tax-estimator/ca/los-angeles-county/los-angeles,los angeles county average property tax rate 2026,0,1,0,10
https://www.mothebroker.com/tools/property-tax-estimator/ca/los-angeles-county/los-angeles,los angeles county effective property tax rate 2026,0,5,0,9.2
