path,impressions,clicks,ctr,position,inboundLinks,topQuery1,topQuery2,topQuery3
/blog/second-home-cash-out-refinance-guide-2026,8419,0,0,7.184582491982421,2,fannie mae cash-out refinance maximum ltv 2026,fannie mae cash-out refinance ltv limits 2026,fannie mae cash-out refinance maximum ltv primary residence 2026
/blog/dscr-loan-interest-only-options-2026,4291,0,0,6.221160568632021,12,commercial real estate underwriting interest-only loans dscr amortizing,commercial real estate underwriting interest-only loans dscr fully amortizing,commercial real estate underwriting interest only loans dscr amortizing
/blog/reverse-mortgage-interest-rates-current-2026,4183,2,0.0004781257470714798,3.8993545302414536,,current reverse mortgage interest rates 2026,current hecm expected interest rate march 2026,current reverse mortgage interest rates march 2026
/blog/heloc-investment-property-2026,3460,0,0,7.241329479768786,7,heloc on rental property eligibility 2025 or 2026,heloc seasoning period requirements 2026,heloc on investment property lenders 2026
/blog/dscr-loans-multi-family-guide-2026,3339,0,0,6.650494159928122,6,dscr loans for multifamily properties 2026,dscr multifamily loan,multifamily dscr loans
/blog/non-qm-loan-programs-complete-guide-2026,3151,0,0,6.549032053316408,7,best no documentation loans 2026,non-qm mortgage trends 2026,non-qm asset depletion mortgage rates 2026
/blog/bank-statement-loans-self-employed-2026,2768,0,0,7.841763005780347,98,bank statement loan rates 2026,personal loans no tax returns self-employed lenders 2026,best bank statement loan lenders 2026
/blog/dscr-loan-california-requirements-complete-2026,2030,0,0,6.816748768472906,2,dscr loan requirements california 2026,dscr loan requirements 2026,dscr loan california requirements
/blog/mortgage-rate-lock-guide-2026,1886,0,0,7.426299045599151,4,mortgage float down option availability 2026,mortgage rate lock options lenders 2026,best mortgage lenders offering float down option 2026
/blog/cash-out-refinance-rental-property-investors-2026,1615,0,0,6.9640866873065015,4,investment property cash out refinance ltv limits 2026,refi investment property cash out,mothebroker.com
/blog/reverse-mortgage-closing-costs-fees-2026,1347,0,0,7.456570155902004,,hecm for purchase closing costs,hecm origination fee cap 2026,reverse mortgage closing cost calculator
/blog/interest-only-mortgage-loans-2026,1310,1,0.0007633587786259542,5.410687022900763,10,"""interest only"" commercial mortgage underwriting ""fully amortizing"" or ""amortized payment""",do commercial underwriters qualify io loans on fully amortizing payment,do commercial underwriters qualify io loans on fully amortized payment
/blog/reverse-mortgage-age-62-requirements-2026,1267,0,0,14.088397790055248,,reverse mortgage age requirements,reverse mortgage age requirement,reverse mortgage age limit
/blog/dscr-loan-prepayment-penalty-guide-2026,1245,0,0,6.65140562248996,4,personal loan prepayment penalties common 2026,dscr loan prepayment penalty typical terms 2026,dscr loan prepayment penalty
/blog/cash-out-refinance-vs-heloc-investment-property-2026,1232,0,0,6.400974025974026,2,refinance options for investment properties 2026,dscr cash out refinance,heloc vs cash out refinance comparison 2026
/blog/dscr-loan-llc-entity-structure-2026,1025,1,0.000975609756097561,8.015609756097561,19,dscr loan for llc,dscr loan for investment property how to apply requirements 2026,dscr loan for investment property how to apply 2026
/blog/dscr-refinance-investment-property-2026,978,0,0,7.970347648261758,15,dscr refi,can you refinance a dscr loan,can i refinance a dscr loan
/tools/property-tax-estimator/ca/orange-county,934,0,0,6.957173447537473,0,property tax rate orange county california 2026,orange county ca property tax rate 2026,orange county california property tax rate 2026
/blog/home-equity-retirement-income-strategy-2026,927,0,0,6.292340884573894,,using your home equity for retirement income,using home equity for retirement income,best home equity loan options for seniors 2026
/blog/heloc-draw-period-repayment-guide-2026,910,0,0,5.825274725274725,7,typical heloc draw period and repayment period 2026,typical heloc terms draw period repayment period 2026,typical heloc draw period length 2026
/blog/foreign-national-mortgage-loans-2026,893,0,0,10.967525195968644,7,foreign national mortgage loans california,california foreign national home mortgages,foreign national loan requirements
/blog/heloc-vs-personal-loan-home-improvement-2026,855,0,0,11.259649122807017,0,personal loan vs heloc for home improvements 2026,heloc vs personal loan for home improvement 2026,home equity loan vs personal loan for home renovations 2026
/blog/dscr-loans-short-term-rentals-airbnb-2026,846,0,0,13.718676122931441,14,dscr loan options for airbnb short term rental properties 2026,dscr loans for short term rentals,dscr loans for airbnb properties
/blog/dscr-loan-requirements-2026,781,0,0,8.43661971830986,59,dscr loan down payment requirements,dscr loan requirements 2026,dscr loan rates 2026 typical range
/blog/dscr-loans-multi-family-2-4-unit-2026,780,0,0,8.669230769230769,5,dscr multifamily loan,multifamily dscr loans,typical dscr for multifamily loans
/blog/dscr-first-investment-property-2026,733,0,0,8.641200545702592,11,dscr loan down payment requirements for rental property 2026,dscr loan requirements 2026,investment property down payment requirements 2026
/blog/asset-depletion-loans-guide-2026,720,0,0,7.476388888888889,23,fannie mae asset depletion guidelines 2026,asset depletion mortgage qualification 2026,asset depletion mortgage requirements 2026
/blog/home-equity-sharing-vs-heloc-2026,719,0,0,9.662030598052851,,best home equity sharing programs 2025 2026,home equity sharing,home equity sharing companies
/blog/non-qm-profit-loss-loans-self-employed-2026,703,0,0,7.5049786628734,3,self employed personal loan requirements 2026,bank statement loans for self-employed 2026,personal loan requirements for self-employed 2026
/blog/reverse-mortgage-calculator-2026,673,0,0,6.790490341753343,,mothebroker.com,,
/tools/property-tax-estimator/ca/santa-clara-county/san-jose,658,0,0,5.937689969604863,0,santa clara county property tax rate 2026,average property tax rate san jose california 2026,san jose ca property tax rate 2026
/blog/cash-out-refinance-seasoning-requirements-2026,655,0,0,7.653435114503817,1,fannie mae cash-out refinance seasoning requirements 2026,mortgage refinance seasoning period requirements 2026,mortgage seasoning requirements for refinance 2026
/blog/jumbo-loans-orange-county-2026,636,0,0,7.470125786163522,38,jumbo loan orange county,orange county jumbo loan limit,california jumbo mortgage rates february 2026
/blog/bridge-loans-vs-dscr-investment-2026,631,0,0,5.508716323296355,22,best real estate bridge loan lenders 2025 2026 comparison,bridge loans commercial real estate interest-only underwriting dscr,bridge loans commercial real estate interest-only dscr
/tools/property-tax-estimator/wa/king-county,628,0,0,7.2165605095541405,0,average property tax rate king county washington 2026,king county wa property tax rate 2026,effective property tax rate king county washington 2026
/blog/dscr-loans-california-best-markets-2026,570,0,0,9.42280701754386,10,dscr loans inyo county,dscr loans colusa county,dscr loans tuolumne county
/blog/home-equity-business-startup-funding-2026,561,0,0,7.527629233511586,,home equity loan for business startup,can you use a heloc to start a business,heloc to start a business
/blog/reverse-mortgage-financial-assessment-2026,559,0,0,7.23613595706619,,hecm financial assessment and property charge guide,reverse mortgage financial assessment,
/tools/property-tax-estimator/ca/los-angeles-county,555,0,0,9.933333333333334,0,burbank ca property tax rate 2026,los angeles county effective property tax rate 2026,average property tax rate los angeles county 2026
/blog/jumbo-loan-requirements-california-washington-2026,534,0,0,14.314606741573034,18,jumbo loan limit california,jumbo loan amount california,california jumbo loan amount
/blog/wholesale-mortgage-condo-financing-2026,532,0,0,5.545112781954887,0,best loan types for buying a condo 2026,condo mortgage requirements vs house 2026,mothebroker.com
/blog/reverse-mortgage-line-of-credit-growth-2026,524,0,0,6.853053435114504,,reverse mortgage line of credit growth rate,current hecm expected interest rate february 2026,hecm reverse mortgage line of credit growth rate 2026
/blog/home-equity-loan-after-bankruptcy-california-2026,498,0,0,9.700803212851406,,heloc after bankruptcy,home equity loan after bankruptcy,factors for heloc approval after bankruptcy
/blog/reverse-mortgage-tax-implications-2026,490,0,0,14.687755102040816,,is reverse mortgage interest tax deductible,reverse mortgage tax implications 2026,is reverse mortgage income taxable
/blog/home-equity-tax-deduction-2026,487,0,0,8.129363449691992,,is home equity loan interest tax deductible for debt consolidation 2026,tcja home equity loan interest deduction expiration,tcja home equity interest deduction expiration 2025 or 2026
/blog/wholesale-mortgage-jumbo-loan-pricing-2026,430,0,0,16.81860465116279,0,mothebroker.com,jumbo loan wholesale,jumbo wholesale mortgage lenders
/blog/wholesale-mortgage-trust-vesting-2026,427,0,0,5.985948477751757,1,mothebroker.com,wholesale trust,
/blog/heloc-requirements-california-washington-2026,427,0,0,7.688524590163935,11,,,
/blog/heloc-interest-rate-forecast-california-2026,426,0,0,7.429577464788732,5,heloc rates forecast 2026,average heloc interest rate us march 2026,current heloc rates california march 2026
/tools/property-tax-estimator/ca/san-diego-county/encinitas,419,0,0,6.878281622911694,0,encinitas ca property tax rate 2026,encinitas property tax rate,encinitas property tax